{"canonicalChecksum":"975fe1133a487da248623e346d760200869b98d3112200327c24dca0668904cd","continuityFieldId":"foundation.spring.continuity","dischargeClass":"MEDIUM","downstreamReachId":"reach-main-stem-1","estimatedWorkUnits":400,"featureId":"spring-head","geometryChecksum":"b10e34710c1770902fb3b2d7ba2a713052e6e90419c9f330826aadf051b557cb","hydrologyNodeId":"hydro.spring.spring-head","hydrologyNodeKind":"SPRING","openingXMillionths":31500000,"openingYMillionths":70000000,"openingZMillionths":3760000,"outflowMaskFieldId":"foundation.spring.outflow-mask","outflowRadiusBlocks":4,"outletRelationId":"spring-supported-by-plain","outletSurfaceFeatureId":"host-plain","outletSurfaceGeometryChecksum":"7558388a2553d2d47f49b3a961aad8683603fcf410b9d8e5497c7f669224c829","ownershipFieldId":"foundation.spring.ownership","planVersion":1,"reachabilityFieldId":"foundation.spring.reachability","riverFeatureId":"main-stem","riverPlanChecksum":"269ca42102418401385f7d29fd554fe7cbd6bed9bf7628ced675238d629851fe","riverRelationId":"spring-empties-into-river","riverSourceNodeId":"source-main-stem-1","sourceBedYMillionths":70000000,"sourceDischargeBlocks":100,"sourceMaskFieldId":"foundation.spring.source-mask","supportRadiusXZ":6}